{
  "schema_version": "gnczmkn.fixture-manifest/1",
  "fixture_id": "REF-LEGACY-CSV-001",
  "status": "capturing",
  "purpose": "Make the frozen Legacy CSV t_k and published-field boundaries executable through semantic field identities while permitting encoding changes.",
  "authority": "validation_lead",
  "provenance": {
    "source_refs": [
      "docs/adr/0001-greenfield-and-legacy-reference.md",
      "design-notes/gnczmkn-architecture-roadmap/00a-yyz-end-to-end-walkthrough.md#10-旧行为-oracle-怎样保护迁移",
      "reference/legacy/source-manifest.json",
      "reference/legacy/reproduction/r0-leg-001-20260810-07/evidence-index.json"
    ],
    "notes": "An external C++17 harness was compiled against a clean frozen extraction with w64devkit GCC 16.2.0 and run twice. The main build verifies both dataset identities, fixture-local semantic mapping, a 50-digit Decimal trajectory, and an independent C++17 probe with no Legacy dependency."
  },
  "expected_facts": [
    {
      "id": "FACT-CSV-TK-TIMESTAMP",
      "claim": "The three semantic samples identify t0=0, t1=0.5 s, and t2=1 s in exact row order.",
      "tolerance_policy": "Row identity, count, and order are exact; the frozen Legacy seed uses absolute time tolerance 1e-12.",
      "evidence_refs": [
        "fixtures/ref-legacy-csv/legacy-run-1.csv",
        "fixtures/ref-legacy-csv/legacy-run-2.csv",
        "oracles/ref-legacy-csv/reference.json",
        "tests/legacy_csv.cpp",
        "tools/legacy_csv_reference.py"
      ]
    },
    {
      "id": "FACT-CSV-PUBLISHED-BOUNDARY",
      "claim": "Altitude and vertical velocity come from the state published at each recorded t_k boundary.",
      "tolerance_policy": "The frozen Legacy state seed uses absolute tolerance 1e-9; target YYZ field tolerances remain pending R0-SCI-003.",
      "evidence_refs": [
        "fixtures/ref-legacy-csv/semantic-fields.json",
        "oracles/ref-legacy-csv/reference.json",
        "tests/legacy_csv.cpp",
        "tools/legacy_csv_reference.py"
      ]
    },
    {
      "id": "FACT-CSV-ENCODING-INDEPENDENCE",
      "claim": "Header-based semantic mapping produces the same dataset after column permutation, finite numeric text reformatting and arbitrary unmapped-column changes, and rejects non-finite required values.",
      "tolerance_policy": "Required field identities are exact; column position, finite Decimal-equivalent text form and unmapped columns are excluded after mapping; NaN and infinities are rejected.",
      "evidence_refs": [
        "fixtures/ref-legacy-csv/semantic-fields.json",
        "tests/legacy_csv.cpp",
        "tools/legacy_csv_reference.py"
      ]
    },
    {
      "id": "FACT-CSV-PROVENANCE",
      "claim": "The dataset is tied to the frozen archive, Simulator, logger, sink, PointMass seed test, capture harness, environment, and reconstructed raw CRLF byte identity.",
      "tolerance_policy": "Paths, byte counts, line-ending transformation, and SHA-256 values are exact.",
      "evidence_refs": [
        "fixtures/ref-legacy-csv/input.json",
        "fixtures/ref-legacy-csv/legacy_capture.cpp",
        "reference/legacy/reproduction/r0-leg-001-20260810-07/logs/legacy-ctest-all.log"
      ]
    }
  ],
  "required_artifacts": [
    "fixtures/ref-legacy-csv/README.md",
    "fixtures/ref-legacy-csv/input.json",
    "fixtures/ref-legacy-csv/semantic-fields.json",
    "fixtures/ref-legacy-csv/legacy_capture.cpp",
    "fixtures/ref-legacy-csv/legacy-run-1.csv",
    "fixtures/ref-legacy-csv/legacy-run-2.csv",
    "oracles/ref-legacy-csv/reference.json",
    "tests/legacy_csv.cpp",
    "tools/legacy_csv_reference.py",
    "CMakeLists.txt"
  ],
  "acceptance": [
    "Verifies frozen source, environment, harness, runtime-test, stored-dataset, and reconstructed raw-capture identities",
    "Two Legacy captures are byte-identical and normalize to the same three semantic rows",
    "Independent 50-digit Decimal and C++17 implementations agree with every semantic row",
    "Column permutation, finite Decimal-equivalent text and unmapped-column changes are accepted after header mapping",
    "Missing t0, shifted t_k, stale published state, non-finite required values, and duplicate required header are rejected",
    "Preserve and Retire recommendations remain visibly pending until the repository owner accepts the disposition choice"
  ],
  "open_tasks": [
    "R0-LEG-002",
    "R0-SCI-003"
  ]
}
