{
  "schema_version": "gnczmkn.fixture-manifest/1",
  "fixture_id": "REF-YYZ-MASS-PROPERTIES-001",
  "status": "executable",
  "purpose": "Provide an executable fixture-local committed MassState projection with Closure and rigid-core consumer links and candidate-publication timing.",
  "authority": "scientific_authority",
  "provenance": {
    "source_refs": [
      "docs/adr/0006-si-frame-and-simulation-time-conventions.md",
      "design-notes/gnczmkn-architecture-roadmap/14-cycle-dataflow-state-transaction-and-continuous-closure.md#16-6dof-轻量闭环的明确时间语义",
      "design-notes/gnczmkn-architecture-roadmap/14-cycle-dataflow-state-transaction-and-continuous-closure.md#181-sampled-interval-edge",
      "design-notes/gnczmkn-architecture-roadmap/15-reference-vertical-designs-and-object-placement.md#83-massproperties",
      "fixtures/ref-yyz-6dof-core/cases.json",
      "fixtures/ref-yyz-force-moment-closure/cases.json",
      "fixtures/ref-yyz-propulsion-response/cases.json"
    ],
    "notes": "This projection-only slice implements identities and domains already fixed by accepted ADR, architecture and executable bundles. Candidate geometry derivation stays outside this model; the accepted constant-geometry scalar-burn choice has the separate REF-YYZ-SCALAR-BURN-MASS-001 identity. Product and Legacy runtime APIs are absent from the executable path."
  },
  "expected_facts": [
    {
      "id": "FACT-YYZ-MASS-PROPERTIES-PROJECTION",
      "claim": "Independent 80-digit Decimal and C++17 implementations project the exact committed positive mass, body-origin-to-CoM point coordinate and full symmetric-positive-definite inertia about the CoM into one same-boundary MassPropertiesSample.",
      "tolerance_policy": "Model, owner, point, frame, clock, tick, revision, interval and quality identities are exact; finite physical values use the fixture-local absolute-plus-relative formula tolerance.",
      "evidence_refs": [
        "fixtures/ref-yyz-mass-properties/cases.json",
        "oracles/ref-yyz-mass-properties/reference.json",
        "tests/yyz_mass_properties.cpp",
        "tools/yyz_mass_properties_reference.py"
      ]
    },
    {
      "id": "FACT-YYZ-MASS-PROPERTIES-CONSUMERS",
      "claim": "The projected CoM locates the Closure application vector and the projected mass/full inertia feed the accepted rigid-core specific-force and rotational equations without diagonalization.",
      "tolerance_policy": "Consumer identities are exact; application vectors, wrench intermediates, reciprocal mass, angular momentum and angular acceleration use the fixture-local formula tolerance.",
      "evidence_refs": [
        "fixtures/ref-yyz-mass-properties/cases.json",
        "oracles/ref-yyz-mass-properties/reference.json",
        "tests/yyz_mass_properties.cpp",
        "tools/yyz_mass_properties_reference.py"
      ]
    },
    {
      "id": "FACT-YYZ-MASS-PROPERTIES-TEMPORAL-FAILURE",
      "claim": "The current committed sample remains visible through its FrozenInterval, the pending scalar mass candidate appears only after the declared commit, and invalid identity/mass/inertia inputs plus early visibility, omitted CoM offset and diagonalized-inertia implementations fail directly.",
      "tolerance_policy": "Visibility, commit tick and rejection identities are exact; tolerance never repairs an invalid state identity, mass or inertia tensor.",
      "evidence_refs": [
        "fixtures/ref-yyz-mass-properties/cases.json",
        "oracles/ref-yyz-mass-properties/reference.json",
        "tests/yyz_mass_properties.cpp",
        "tools/yyz_mass_properties_reference.py"
      ]
    }
  ],
  "required_artifacts": [
    "fixtures/ref-yyz-mass-properties/README.md",
    "fixtures/ref-yyz-mass-properties/cases.json",
    "oracles/ref-yyz-mass-properties/reference.json",
    "tests/yyz_mass_properties.cpp",
    "tools/yyz_mass_properties_reference.py",
    "CMakeLists.txt"
  ],
  "acceptance": [
    "The bundle records committed projection identity, full inertia, CoM-to-application geometry, direct Closure/rigid-core consumers and candidate publication timing",
    "The Python reference and C++17 probe share no implementation and neither imports product or Legacy code",
    "Mass evolution remains outside this projection-only identity; REF-YYZ-SCALAR-BURN-MASS-001 covers the accepted constant-geometry scalar-burn approximation"
  ]
}
