{
  "schema_version": "gnczmkn.fixture-manifest/1",
  "fixture_id": "REF-YYZ-FORCE-MOMENT-CLOSURE-001",
  "status": "executable",
  "purpose": "Provide an executable fixture-local FrozenInterval force/moment closure and its short analytic rigid-core trajectory within the accepted applicability domain.",
  "authority": "scientific_authority",
  "provenance": {
    "source_refs": [
      "docs/adr/0006-si-frame-and-simulation-time-conventions.md",
      "docs/adr/0007-passive-hamilton-quaternion-convention.md",
      "design-notes/gnczmkn-architecture-roadmap/15-reference-vertical-designs-and-object-placement.md#84-closure",
      "docs/quality/yyz-reference-bundle-design.md#72-公式覆盖矩阵"
    ],
    "notes": "The Scientific Authority accepted the fixture-local FrozenInterval strategy, r_CoM_to_application_B sign, gravity separation, unique source identity and shared configuration revision. The bundle has no product or Legacy dependency."
  },
  "expected_facts": [
    {
      "id": "FACT-YYZ-CLOSURE-WRENCH",
      "claim": "Independent Decimal and C++17 implementations agree on each source force, lever-arm moment, moment transported to the center of mass, and canonical total body wrench.",
      "tolerance_policy": "Source, frame, revision and interval identities are exact; finite vector components use the fixture-local absolute-plus-relative formula tolerance.",
      "evidence_refs": [
        "fixtures/ref-yyz-force-moment-closure/cases.json",
        "oracles/ref-yyz-force-moment-closure/reference.json",
        "tests/yyz_force_moment_closure.cpp",
        "tools/yyz_force_moment_closure_reference.py"
      ]
    },
    {
      "id": "FACT-YYZ-CLOSURE-RIGID-CORE-TRAJECTORY",
      "claim": "The frozen closure total feeds the accepted rigid-body core and reproduces the analytic constant-acceleration trajectory while gravity remains a separate inertial acceleration.",
      "tolerance_policy": "Tick and terminal identity are exact; time, state, held force/moment and separate gravity fields use their declared fixture-local tolerances.",
      "evidence_refs": [
        "fixtures/ref-yyz-force-moment-closure/cases.json",
        "oracles/ref-yyz-force-moment-closure/reference.json",
        "tests/yyz_force_moment_closure.cpp",
        "tools/yyz_force_moment_closure_reference.py"
      ]
    },
    {
      "id": "FACT-YYZ-CLOSURE-FAILURE",
      "claim": "Contribution order is semantically irrelevant, incompatible identity/time inputs are rejected, and reversed application-vector, pre-transported application moment or gravity-double-count implementations fail the oracle.",
      "tolerance_policy": "Equivalence, rejection identities and mutation dispositions are exact.",
      "evidence_refs": [
        "fixtures/ref-yyz-force-moment-closure/cases.json",
        "oracles/ref-yyz-force-moment-closure/reference.json",
        "tests/yyz_force_moment_closure.cpp",
        "tools/yyz_force_moment_closure_reference.py"
      ]
    }
  ],
  "required_artifacts": [
    "fixtures/ref-yyz-force-moment-closure/README.md",
    "fixtures/ref-yyz-force-moment-closure/cases.json",
    "oracles/ref-yyz-force-moment-closure/reference.json",
    "tests/yyz_force_moment_closure.cpp",
    "tools/yyz_force_moment_closure_reference.py",
    "CMakeLists.txt"
  ],
  "acceptance": [
    "The bundle records per-source wrench transport, canonical totals, the frozen rigid-core input and an analytic trajectory",
    "The Python reference and C++17 probe share no implementation and neither imports product or Legacy code",
    "The canonical aero, propulsion, mass, configuration and gravity models remain outside this fixture-local slice"
  ]
}
