{
  "schema_version": "gnczmkn.fixture-manifest/1",
  "fixture_id": "REF-YYZ-AERO-LOOKUP-001",
  "status": "executable",
  "purpose": "Provide an executable fixture-local prepared aerodynamic coefficient table, trilinear pure query, strict applicability domain and dimensionalization consumer link.",
  "authority": "scientific_authority",
  "provenance": {
    "source_refs": [
      "design-notes/gnczmkn-architecture-roadmap/12-runtime-object-model-and-component-anatomy.md#310-purequerydescriptor-execution-form",
      "design-notes/gnczmkn-architecture-roadmap/15-reference-vertical-designs-and-object-placement.md#81-aerodynamics",
      "design-notes/gnczmkn-architecture-roadmap/07-diagnostics-reliability-and-observability.md#134-模型适用域",
      "fixtures/ref-yyz-air-data-kinematics/cases.json",
      "fixtures/ref-yyz-aero-dimensionalization/cases.json"
    ],
    "notes": "The repository owner accepted the recommended fixture-local trilinear, inclusive-domain, no-extrapolation choice. The numeric table is synthetic and multi-affine, used only to verify lookup semantics and the existing dimensionalization consumer."
  },
  "expected_facts": [
    {
      "id": "FACT-YYZ-AERO-LOOKUP-TRILINEAR",
      "claim": "Independent 80-digit Decimal and C++17 implementations locate three strict-axis brackets and reproduce the six multi-affine coefficients with an eight-corner tensor product.",
      "tolerance_policy": "Model/table/configuration/sample identities and bracket indices are exact; weights and coefficients use the fixture-local formula tolerance.",
      "evidence_refs": [
        "fixtures/ref-yyz-aero-lookup/cases.json",
        "oracles/ref-yyz-aero-lookup/reference.json",
        "tests/yyz_aero_lookup.cpp",
        "tools/yyz_aero_lookup_reference.py"
      ]
    },
    {
      "id": "FACT-YYZ-AERO-LOOKUP-CONSUMER",
      "claim": "Interior, knot and upper-boundary responses feed the accepted body-axis aerodynamic dimensionalization with the existing coefficient order and reference-length policy.",
      "tolerance_policy": "Coefficient convention and domain status are exact; force and moment values use the fixture-local formula tolerance.",
      "evidence_refs": [
        "fixtures/ref-yyz-aero-lookup/cases.json",
        "oracles/ref-yyz-aero-lookup/reference.json",
        "tests/yyz_aero_lookup.cpp",
        "tools/yyz_aero_lookup_reference.py"
      ]
    },
    {
      "id": "FACT-YYZ-AERO-LOOKUP-DOMAIN-FAILURES",
      "claim": "Interpolation nesting order is physically equivalent, while invalid query/asset identity, unsupported inputs, axis/table defects, out-of-range values, nearest-neighbor substitution, clamping, axis swap and omitted beta interpolation fail directly.",
      "tolerance_policy": "Failure and equivalence identities are exact; tolerance cannot admit an invalid table or out-of-domain query.",
      "evidence_refs": [
        "fixtures/ref-yyz-aero-lookup/cases.json",
        "oracles/ref-yyz-aero-lookup/reference.json",
        "tests/yyz_aero_lookup.cpp",
        "tools/yyz_aero_lookup_reference.py"
      ]
    }
  ],
  "required_artifacts": [
    "fixtures/ref-yyz-aero-lookup/README.md",
    "fixtures/ref-yyz-aero-lookup/cases.json",
    "oracles/ref-yyz-aero-lookup/reference.json",
    "tests/yyz_aero_lookup.cpp",
    "tools/yyz_aero_lookup_reference.py",
    "CMakeLists.txt"
  ],
  "acceptance": [
    "The bundle fixes strict prepared axes, trilinear interpolation, inclusive applicability, no extrapolation and the existing coefficient convention",
    "The Decimal reference and C++17 probe share no implementation and neither imports product or Legacy code",
    "Canonical assets, loaders, nonzero rates/surfaces, derivative queries and product contracts remain outside this slice"
  ],
  "open_tasks": ["R0-SCI-003"]
}
